{
  "$schema": "https://json-schema.org/draft/2020-12/schema",
  "$id": "agentic-planning/planning-decomposition.schema.json",
  "title": "Planning Decomposition Record",
  "type": "object",
  "required": [
    "kind",
    "title",
    "status",
    "larger_intended_outcome",
    "non_goals",
    "candidate_lanes",
    "proof_expectations",
    "promotion_rule"
  ],
  "additionalProperties": false,
  "properties": {
    "kind": {
      "const": "planning-decomposition/v1"
    },
    "title": {
      "type": "string"
    },
    "status": {
      "enum": [
        "shaping",
        "ready-for-lane-promotion",
        "partially-promoted",
        "closed"
      ]
    },
    "larger_intended_outcome": {
      "type": "string"
    },
    "parent_acceptance": {
      "$ref": "#/$defs/parent_acceptance"
    },
    "non_goals": {
      "$ref": "#/$defs/string_array"
    },
    "candidate_lanes": {
      "type": "array",
      "items": {
        "$ref": "#/$defs/candidate_lane"
      }
    },
    "dependency_assumptions": {
      "$ref": "#/$defs/string_array"
    },
    "parallelization_assumptions": {
      "$ref": "#/$defs/string_array"
    },
    "proof_expectations": {
      "$ref": "#/$defs/string_array"
    },
    "promotion_rule": {
      "type": "string"
    },
    "references": {
      "type": "array",
      "items": {
        "$ref": "#/$defs/reference"
      }
    },
    "notes": {
      "type": "string"
    }
  },
  "$defs": {
    "string_array": {
      "type": "array",
      "items": {
        "type": "string"
      }
    },
    "candidate_lane": {
      "type": "object",
      "required": [
        "id",
        "title",
        "readiness",
        "outcome",
        "owner_surface"
      ],
      "additionalProperties": false,
      "properties": {
        "id": {
          "type": "string"
        },
        "title": {
          "type": "string"
        },
        "readiness": {
          "enum": [
            "needs-shaping",
            "ready",
            "promoted",
            "blocked",
            "deferred"
          ]
        },
        "outcome": {
          "type": "string"
        },
        "owner_surface": {
          "type": "string"
        },
        "proof": {
          "type": "string"
        },
        "slice_contribution_to_parent": {
          "type": "string"
        },
        "residual_parent_intent": {
          "type": "string"
        },
        "parent_proof_boundary": {
          "type": "string"
        },
        "human_confirmation_needed": {
          "$ref": "#/$defs/string_array"
        },
        "depends_on": {
          "$ref": "#/$defs/string_array"
        },
        "parallel_with": {
          "$ref": "#/$defs/string_array"
        }
      }
    },
    "parent_acceptance": {
      "type": "object",
      "required": [
        "original_intent",
        "acceptance_target",
        "parent_proof_required"
      ],
      "additionalProperties": false,
      "properties": {
        "original_intent": {
          "type": "string"
        },
        "acceptance_target": {
          "type": "string"
        },
        "parent_proof_required": {
          "type": "string"
        },
        "residual_intent_rule": {
          "type": "string"
        },
        "clarification_needed_when": {
          "type": "string"
        }
      }
    },
    "reference": {
      "type": "object",
      "additionalProperties": false,
      "properties": {
        "kind": {
          "type": "string"
        },
        "target": {
          "type": "string"
        },
        "label": {
          "type": "string"
        },
        "role": {
          "type": "string"
        }
      }
    }
  }
}

